,title,subtiltle,link
0,"SAY WHAT? Sancho REMOVED from Man Utd WhatsApp group with Old Trafford future looking bleak
UNITED outcast has been removed from the WhatsApp group that is used to keep players up to date with team news. This is just another sign that shows Sancho's future at Old Trafford is getting more uncertain.",Sancho REMOVED from Man Utd WhatsApp group with Old Trafford future looking bleak,https://www.thesun.co.uk/sport/24652616/jadon-sancho-manchester-united-whatsapp-erik-ten-hag/
1,STAY TOONED Arteta to escape punishment for VAR rant after Newcastle loss... for now,Arteta to escape punishment for VAR rant after Newcastle loss... for now,https://www.thesun.co.uk/sport/24650653/arsenal-mikel-arteta-fa-punishment-var-rant-newcastle/
2,FIT FOR A KING Charles to announce huge change that will be 'watershed moment' for football,Charles to announce huge change that will be 'watershed moment' for football,https://www.thesun.co.uk/sport/24652939/king-charles-football-regulator/
3,"DAVE KIDD VAR is opposite to spirit of Beautiful Game, it just increases rage & bitterness","VAR is opposite to spirit of Beautiful Game, it just increases rage & bitterness",https://www.thesun.co.uk/sport/24651378/var-arsenal-newcastle-dave-kidd/
4,YOU'RE WELCOME All the best UK casino welcome bonuses for new players revealed,All the best UK casino welcome bonuses for new players revealed,https://www.thesun.co.uk/betting/21097803/casino-welcome-bonus/
5,POST ROAR Postecoglou gives five-word answer when asked if Spurs will change tactics,Postecoglou gives five-word answer when asked if Spurs will change tactics,https://www.thesun.co.uk/sport/24653121/ange-postecoglou-tactics-chelsea/
6,TREBLE 'N STRIFE Fans stunned by Mudryk's reaction as Jackson completes Chelsea hat-trick,Fans stunned by Mudryk's reaction as Jackson completes Chelsea hat-trick,https://www.thesun.co.uk/sport/24652866/mudryk-reaction-chelsea-jackson-goal-tottenham/
7,RATINGS Jackson doubles his season's tally but Fernandez fails to impose in barnstormer,Jackson doubles his season's tally but Fernandez fails to impose in barnstormer,https://www.thesun.co.uk/football/24652223/chelsea-player-ratings-jackson-fernandez-premier-league-tottenham/
8,"END IT LIKE BECKHAM Romero SENT OFF for horror lunge straight after mad 'Beckham' kick
SPURS defender was lucky not to have been sent off moments before his tackle on international team-mate. And team-mate Udogie somehow stayed on pitch afetr shocking lunge in crazy first half.",Romero SENT OFF for horror lunge straight after mad 'Beckham' kick,https://www.thesun.co.uk/sport/24651757/cristian-romero-sent-off-chelsea-var/
9,DESTINY'S WILD Postecoglou blanks Udogie after 'mad' moment sees Spurs reduced to NINE men,Postecoglou blanks Udogie after 'mad' moment sees Spurs reduced to NINE men,https://www.thesun.co.uk/sport/24652338/ange-postecoglou-destiny-udogie-tottenham/
10,SEETHING SPURS Tottenham fans fume as James escapes red after catching Udogie with elbow,Tottenham fans fume as James escapes red after catching Udogie with elbow,https://www.thesun.co.uk/sport/24652046/tottenham-fans-fume-reece-james-escapes-red-card/
11,MAKES YOU MADD Ten-man Spurs rocked as star man Maddison & Van de Ven hobble off vs Chelsea,Ten-man Spurs rocked as star man Maddison & Van de Ven hobble off vs Chelsea,https://www.thesun.co.uk/sport/24651944/tottenham-chelsea-injuries-van-de-ven-maddison/
12,REPLAY CHAOS Spurs leave their own fans raging after showing controversial Romero replay,Spurs leave their own fans raging after showing controversial Romero replay,https://www.thesun.co.uk/sport/24651998/tottenham-big-screen-chelsea-cristian-romero/
13,"PULLING BACK New hopes for Luis Diaz's kidnapped dad as military withdraw from search area
THE terror group ELN kidnapped the Liverpool star's father and mother at gunpoint in Colombia nine days ago.",New hopes for Luis Diaz's kidnapped dad as military withdraw from search area,https://www.thesun.co.uk/sport/24646734/eln-guerillas-kidnap-luis-diazs-dad-security-guarantees-freeing/
14,MUS BE AWFUL Hojlund 'cooked' on MNF for horror stat but Utd fans say they know the truth,Hojlund 'cooked' on MNF for horror stat but Utd fans say they know the truth,https://www.thesun.co.uk/sport/24651563/rasmus-hojlund-monday-night-football-cooked/
15,BURN OUT Newcastle suffer injury blow with Dan Burn out for months with spinal injury,Newcastle suffer injury blow with Dan Burn out for months with spinal injury,https://www.thesun.co.uk/sport/24650677/newcastle-champions-league-dan-burn-injury/
16,PHIL THE POST Phil Neville lands new job five months after David Beckham axed him,Phil Neville lands new job five months after David Beckham axed him,https://www.thesun.co.uk/sport/24653010/phil-neville-portland-timbers-new-manager-miami-beckham/
17,NEVER SAY NEVER Forgotten Premier League star once sacked by Gary Neville gets new job,Forgotten Premier League star once sacked by Gary Neville gets new job,https://www.thesun.co.uk/sport/24649494/forgotten-premier-league-star-once-sacked-by-gary-neville-gets-new-job/
18,"FINAL WARNING Arteta is a 'Mercedes version of Neil Warnock' says referee charity
THE REFEREE's charity has warned Arteta's behaviour filters down to grassroots level. The charity's CEO attacked not only Arteta, but the behaviour of the club too.",Arteta is a 'Mercedes version of Neil Warnock' says referee charity,https://www.thesun.co.uk/sport/24650473/mikel-arteta-referees-charity-arsenal/
19,ART OF THE MATTER What Arteta 'privately told Arsenal stars' before his Newcastle VAR rant,What Arteta 'privately told Arsenal stars' before his Newcastle VAR rant,https://www.thesun.co.uk/sport/24648121/mikel-arteta-arsenal-var-rant-newcastle-loss/
20,STEP TOO VAR Gary Neville slams Arsenal statement on VAR controversy as 'dangerous',Gary Neville slams Arsenal statement on VAR controversy as 'dangerous',https://www.thesun.co.uk/sport/24651120/gary-neville-slams-arsenal-statement-var-controversy/
21,WRIGHT & WRONG Wright launches X-rated response to VAR controversy over Newcastle's winner,Wright launches X-rated response to VAR controversy over Newcastle's winner,https://www.thesun.co.uk/sport/24650989/ian-wright-var-newcastle-arsenal/
22,THE SPECIAL WAND Neville imitates Arsenal vs Toon VAR debate as optical illusion fools fans,Neville imitates Arsenal vs Toon VAR debate as optical illusion fools fans,https://www.thesun.co.uk/sport/24651174/gary-neville-recreates-arsenal-newcastle-var-goal/
23,"MAJA MIA Prem's 'hottest Wag' looks stunning as she puts on show in figure-hugging dress
MAJA LINDELOF donned a blue dress, which left little to the imagination. She posted a picture of the outfit on her social media.",Prem's 'hottest Wag' looks stunning as she puts on show in figure-hugging dress,https://www.thesun.co.uk/sport/24644624/maja-lindelof-victor-man-utd-premier-league/
24,LIONS SHARE Millwall announce England boss and Lampard's ex-coach as their new manager,Millwall announce England boss and Lampard's ex-coach as their new manager,https://www.thesun.co.uk/sport/24650272/millwall-new-manager-joe-edwards-rowett-replaced/
25,PERSONALITY BASH Ex-Man Utd star says Spurs have a 'different level of person' to Reds,Ex-Man Utd star says Spurs have a 'different level of person' to Reds,https://www.thesun.co.uk/sport/24650504/ex-man-utd-star-tottenham-different-level-person/
26,JOG ON I'm a three-time Prem champion and since retiring I've taken up a tough new sport,I'm a three-time Prem champion and since retiring I've taken up a tough new sport,https://www.thesun.co.uk/sport/24649915/robert-huth-leicester-city-chelsea-marathon/
27,GHANA GET HIM Fierce rivals Sunderland and Middlesbrough in transfer race for wonderkid,Fierce rivals Sunderland and Middlesbrough in transfer race for wonderkid,https://www.thesun.co.uk/sport/24651675/sunderland-middlesbrough-transfer-race-championship-wonderkid/
28,"MENDY’S MANSION Inside Mendy’s £5m home after he slashes price as it languishes on market
THE former Manchester City footballer, 29, must sell the sprawling property to avoid financial ruin. ",Inside Mendy’s £5m home after he slashes price as it languishes on market,https://www.thesun.co.uk/sport/24647270/benjamin-mendy-mansion-slash-price/
29,NO SANCTIONS Luton escape FA punishment for chants vs Liverpool as talks held with police,Luton escape FA punishment for chants vs Liverpool as talks held with police,https://www.thesun.co.uk/sport/24648205/luton-chants-liverpool-jamie-carragher-police/
30,'MAJESTIC' Fans in awe at 'nicely garnished' turkey and stuffing roll at Barnsley Women,Fans in awe at 'nicely garnished' turkey and stuffing roll at Barnsley Women,https://www.thesun.co.uk/sport/24646934/fans-awe-festive-turkey-stuffing-roll-barnsley/
31,CHI ISSUE Man Utd ‘could go back for Chiesa transfer' but face competition from Arsenal,Man Utd ‘could go back for Chiesa transfer' but face competition from Arsenal,https://www.thesun.co.uk/sport/24645694/manchester-united-arsensal-transfer-federico-chiesa-juventus/
32,LIONS DEN England fans thrilled as Wembley opponents revealed for pre-Euro 2024 clashes,England fans thrilled as Wembley opponents revealed for pre-Euro 2024 clashes,https://www.thesun.co.uk/sport/24647851/england-friendlies-wembley-euro-2024-brazil-belgium/
33,FREE AND EASY All the best free bets & sign up offers for punters right here,All the best free bets & sign up offers for punters right here,https://www.thesun.co.uk/betting/20812234/best-free-bets-sign-up-offers/
34,TOP BONUS Get £20 in free bets when you stake £5 on football with Ladbrokes,Get £20 in free bets when you stake £5 on football with Ladbrokes,https://www.thesun.co.uk/sport/22580085/ladbrokes-free-bets-new-customer-bonus-football/
35,FAB £30 Get £30 in FREE BETS when you place any amount on any sports market with Sky Bet,Get £30 in FREE BETS when you place any amount on any sports market with Sky Bet,https://www.thesun.co.uk/sport/football/19781466/sky-bet-30-free-bets/
36,"PRIORITY BOARDING Arsenal opponents 'STEAL' flight & leave fuming passengers stranded
THERE was uproar at Vigo Airport as a team were given priority to board a plane over paying customers that were left with no other travel arrangements. The LaLiga giants played away to Celta Vigo on Saturday.",Arsenal opponents 'STEAL' flight & leave fuming passengers stranded,https://www.thesun.co.uk/sport/24644423/passengers-sevilla-arsenal-flight-stranded-airport/
37,TACTICAL RAGE Piers reveals Fergie theory & claims to know reason behind Arteta's VAR rant,Piers reveals Fergie theory & claims to know reason behind Arteta's VAR rant,https://www.thesun.co.uk/sport/24647302/piers-morgan-alex-ferguson-theory-var-rant-arsenal-newcastle/
38,LINKED IN Gary Lineker opens up on being offered Maradona interview.. in a nightclub at 4am,Gary Lineker opens up on being offered Maradona interview.. in a nightclub at 4am,https://www.thesun.co.uk/sport/24645866/gary-lineker-interview-diego-maradona-nightclub-4am/
39,MESS-MERISING I'm a millionaire internet star... Messi outbid me for my dream home in Miami,I'm a millionaire internet star... Messi outbid me for my dream home in Miami,https://www.thesun.co.uk/sport/24647033/adin-ross-lionel-messi-outbid-home-miami/
40,WHAT A RESULT Need your footie news INSTANTLY? Join our Sports WhatsApp channel in 3 steps,Need your footie news INSTANTLY? Join our Sports WhatsApp channel in 3 steps,https://www.thesun.co.uk/sport/24260972/how-join-suns-sports-whatsapp-channel/
41,"BOG STANDARD Toilet roof at Prem stadium collapses leaving gaping hole and plaster on floor
MOST punters want a bit of peace when relieving themselves in public. But one top-flight footy arena couldn't hold it in much longer.",Toilet roof at Prem stadium collapses leaving gaping hole and plaster on floor,https://www.thesun.co.uk/sport/24641327/luton-town-toilet-roof-collapse-kenilworth-road/
42,PREM ACE DEBT BLOW Ex-Premier League star loses £782k after restaurant business fails,Ex-Premier League star loses £782k after restaurant business fails,https://www.thesun.co.uk/sport/24640093/danny-drinkwater-debt-restaurant-business-fails/
43,BLUE PURSUIT Chelsea 'increasing pressure' for Osimhen deal as they eye Jackson replacement,Chelsea 'increasing pressure' for Osimhen deal as they eye Jackson replacement,https://www.thesun.co.uk/sport/24645701/chelsea-increasing-pressure-napoli-victor-osimhen-transfer/
44,ANT PLAN Man Utd were sent Antony warning DAYS before transfer and told to buy other winger,Man Utd were sent Antony warning DAYS before transfer and told to buy other winger,https://www.thesun.co.uk/sport/24646383/man-utd-antony-warning-days-transfer-liverpool-gakpo/
45,BREACH FOR THE STARS Who is Jules Breach and what football team does she support?,Who is Jules Breach and what football team does she support?,https://www.thesun.co.uk/sport/21954416/who-is-jules-breach-what-football-team-does-support/
46,"CAM-ERA READY McTominay's stunning Wag Cam sparkles in glittery crop top as fans show love
CAM wowed her fans with her outfit as she attended a swanky London restaurant. She regularly dresses to impress and often shares glamorous photos on social media.",McTominay's stunning Wag Cam sparkles in glittery crop top as fans show love,https://www.thesun.co.uk/sport/24642660/scott-mctominay-wag-cam-reading/
47,FAB NEWS Join Fabulous Vegas and get a 100% deposit match bonus and 50 free spins,Join Fabulous Vegas and get a 100% deposit match bonus and 50 free spins,https://www.thesun.co.uk/sun-bingo/23596453/join-fabulous-vegas-bonus-match-free-spins/
48,TOP OF THE SLOTS Best payout slots for UK revealed - and where you can play them,Best payout slots for UK revealed - and where you can play them,https://www.thesun.co.uk/betting/22472603/top-payout-slots-uk/
49,DUELZ IN THE CROWN Sign up to get up to £100 deposit bonus & 100 free spins at Duelz Casino,Sign up to get up to £100 deposit bonus & 100 free spins at Duelz Casino,https://www.thesun.co.uk/betting/21848309/matched-deposit-bonus-duelz-casino/
50,"REFFIN' HELL Moment ref's surrounded by fuming players and MANHANDLED with shirt grabbed
VANCOUVER WHITECAPS players were enraged during the closing stages of their MLS Cup play-off match",Moment ref's surrounded by fuming players and MANHANDLED with shirt grabbed,https://www.thesun.co.uk/sport/24650090/mls-cup-referee-vancouver-whitecaps-lafc/
51,GUNNED DOWN Neville's perfect response to Arsenal fan who wanted him BANNED from Emirates,Neville's perfect response to Arsenal fan who wanted him BANNED from Emirates,https://www.thesun.co.uk/sport/24644157/gary-neville-arsenal-fan-emirates-ban-newcastle-goal/
52,COLL CALL Man Utd almost solved defensive woes four years ago with thriving Prem star,Man Utd almost solved defensive woes four years ago with thriving Prem star,https://www.thesun.co.uk/sport/24643253/man-utd-defensive-woes-nathan-collins-transfer/
53,POCH'S BLUES Chelsea suffer huge blow as key member of Pochettino's backroom staff leaves,Chelsea suffer huge blow as key member of Pochettino's backroom staff leaves,https://www.thesun.co.uk/sport/24650807/chelsea-pochettino-andy-myers-millwall-joe-edwards/
54,BLUE IT Ex-Chelsea star who played just 18 Prem minutes inspiring unlikely title charge,Ex-Chelsea star who played just 18 Prem minutes inspiring unlikely title charge,https://www.thesun.co.uk/sport/24648890/forgotten-chelsea-star-jeremie-boga-title-charge-mbappe/
55,"BRU ARE YA? Baffling moment fan in Fulham scarf appears to CELEBRATE United winner
SEVERAL supporters in the home end appeared to cheer Bruno Fernandes' goal. Other Fulham fans criticised the club for pricing out real supporters.",Baffling moment fan in Fulham scarf appears to CELEBRATE United winner,https://www.thesun.co.uk/sport/football/24643083/fulham-bruno-fernandes-man-utd/
56,IN FOR THE KYL Real Madrid hopeful star ‘secret weapon’ could land Mbappe and Davies deals,Real Madrid hopeful star ‘secret weapon’ could land Mbappe and Davies deals,https://www.thesun.co.uk/sport/24643191/real-madrid-kylian-mbappe-alphonso-davies-vinivius-junior/
57,TARGET ON AK Ex-Arsenal star opens up on ‘catastrophic’ time after move to Euro giants,Ex-Arsenal star opens up on ‘catastrophic’ time after move to Euro giants,https://www.thesun.co.uk/sport/24648644/chuba-apom-ajax-arsenal/
58,RED IT Man Utd fans want Mason Greenwood to 'come home' after Getafe success,Man Utd fans want Mason Greenwood to 'come home' after Getafe success,https://www.thesun.co.uk/sport/24623438/man-utd-fans-mason-greenwood-home-getafe/
59,GUNNER LEAVE? Arsenal star lined up for huge Euro transfer & he 'wouldn't be sad' to leave,Arsenal star lined up for huge Euro transfer & he 'wouldn't be sad' to leave,https://www.thesun.co.uk/sport/24643819/arsenal-jakub-kiwior-ac-milan-transfer/
60,"MAN UTD NEWS Fernandes 'lined up' for shock EXIT, Ratcliffe 'makes Ten Hag decision'","Fernandes 'lined up' for shock EXIT, Ratcliffe 'makes Ten Hag decision'",https://www.thesun.co.uk/sport/24408842/man-utd-news-live-fernandes-transfer-ratcliffe-ten-hag/
61,"ARSENAL NEWS Arteta to escape FA punishment amid VAR controversy, Jesus return EXCLUSIVE","Arteta to escape FA punishment amid VAR controversy, Jesus return EXCLUSIVE",https://www.thesun.co.uk/sport/24268915/arsenal-news-live-arteta-var-reaction-newcastle-odegaard-injury/
62,HOT WHEELS Win a McLaren or £100k cash alternative from just 62p with our discount code,Win a McLaren or £100k cash alternative from just 62p with our discount code,https://www.thesun.co.uk/sport/22922880/win-car-competition-7dp/
63,CITY SLICKER Dream Team gaffers on alert as electric Jeremy Doku goes big vs Bournemouth,Dream Team gaffers on alert as electric Jeremy Doku goes big vs Bournemouth,https://www.thesun.co.uk/sport/football/dream-team/24643598/manchester-city-jeremy-doku-bournemouth-fantasy-football-points/
64,UNITED FRONT Bruno Fernandes remains excellent Dream Team option despite Man United malaise,Bruno Fernandes remains excellent Dream Team option despite Man United malaise,https://www.thesun.co.uk/sport/football/dream-team/24645625/bruno-fernandes-manchester-united-malaise-fantasy-football-goal/
65,TAKING THE MYK Dream Team's most in-form defender currently features in just 0.1% of teams,Dream Team's most in-form defender currently features in just 0.1% of teams,https://www.thesun.co.uk/sport/football/dream-team/24647831/vitaliy-mykolenko-everton-fantasy-football-premier-league-points/
66,"SICK & VILE Guimaraes and Willock sent vile racist abuse on social media after Arsenal win
NEWCASTLE released a statement slamming the racist messages. The pair were both targeted by sick messages on social media.",Guimaraes and Willock sent vile racist abuse on social media after Arsenal win,https://www.thesun.co.uk/sport/24636982/newcastle-bruno-guimaraes-joe-willock-racist-abuse-arsenal/
67,LUTON 1 LIVERPOOL 1 Emotional Luis Diaz scores dramatic late equaliser against Hatters,Emotional Luis Diaz scores dramatic late equaliser against Hatters,https://www.thesun.co.uk/sport/24573224/luton-vs-liverpool-live-score-latest-premier-league-updates/
68,FOREST 2 ASTON VILLA 0 Aina stunner and Martinez blunder hands Cooper's side valuable win,Aina stunner and Martinez blunder hands Cooper's side valuable win,https://www.thesun.co.uk/sport/24572425/nottingham-forest-vs-aston-villa-live-score-latest-premier-league-updates/
69,HEN DO Dean Henderson's return date revealed after scan following injury on Man Utd return,Dean Henderson's return date revealed after scan following injury on Man Utd return,https://www.thesun.co.uk/sport/24637516/dean-henderson-crystal-palace-injury-man-utd/
70,CARR BLIMEY Carragher & Neville slam Arsenal for backing Mikel Arteta after angry VAR rant,Carragher & Neville slam Arsenal for backing Mikel Arteta after angry VAR rant,https://www.thesun.co.uk/sport/24638978/arsenal-mikel-arteta-var-jamie-carragher-gary-neville-react/
71,"'GORGEOUS' Chelsea icon's daughter shows what's under her robe & is compared to film star
JADE left her followers in awe thanks to her latest racy social media post. She stunned her fans with an incredible outfit change.",Chelsea icon's daughter shows what's under her robe & is compared to film star,https://www.thesun.co.uk/sport/24646360/chelsea-frank-leboeuf-daughter-jade-robe-hollywood/
72,RED-FACED Harry Kane suffers blow off pitch despite sparkling form for Bayern Munich move,Harry Kane suffers blow off pitch despite sparkling form for Bayern Munich move,https://www.thesun.co.uk/sport/24640779/harry-kane-living-hotel-tab-house-bayern-munich/
73,TUCH TO TAKE Tuchel walks out of interview after Bayern Munich thump Borussia Dortmund,Tuchel walks out of interview after Bayern Munich thump Borussia Dortmund,https://www.thesun.co.uk/sport/24637741/thomas-tuchel-bayern-munich-borussia-dortmund/
74,BELL TOLLS Bellingham ‘considering shock new career providing security for footballers’,Bellingham ‘considering shock new career providing security for footballers’,https://www.thesun.co.uk/sport/24635206/jude-bellingham-real-madrid-england-home-security/
75,WAY-ING IN Wayne Lineker releases statement over 'disgusting' chants directed towards him,Wayne Lineker releases statement over 'disgusting' chants directed towards him,https://www.thesun.co.uk/sport/24640958/wayne-lineker-releases-statement-peter-crouch-chants/
76,TROY DEENEY Toney has two options but doesn't fit Arsenal and would he want Chelsea circus?,Toney has two options but doesn't fit Arsenal and would he want Chelsea circus?,https://www.thesun.co.uk/sport/24626236/ivan-toney-arsenal-transfer-chelsea/
77,KARREN BRADY Why do men hurl missiles at team buses? It's lucky no one died in Lyon attack,Why do men hurl missiles at team buses? It's lucky no one died in Lyon attack,https://www.thesun.co.uk/sport/24626544/team-bus-attack-lyon-karen-brady/
78,NEIL CUSTIS Ten Hag is set to be spat out by Man Utd monster only Fergie could tame,Ten Hag is set to be spat out by Man Utd monster only Fergie could tame,https://www.thesun.co.uk/sport/24615590/pathetic-man-utd-ten-hag-spat-out/
79,"REDDY & GO Fans love Sky presenter Melissa Reddy’s outfit as she puts on leggy display
MELISSA REDDY left little to the imagination as she donned a white outfit on Soccer Sunday which left fans stunned. The presenter has been racking up the followers on social media for posts such as this.",Fans love Sky presenter Melissa Reddy’s outfit as she puts on leggy display,https://www.thesun.co.uk/sport/24643977/sky-sports-melissa-reddy-leggy-display/
80,GOI-GEOUS Ex-Barcelona Wag and 'world's hottest woman' risque post risks Instagram ban,Ex-Barcelona Wag and 'world's hottest woman' risque post risks Instagram ban,https://www.thesun.co.uk/sport/24640184/barcelona-wag-worlds-hottest-woman-jessica-goicoecha-bartra/
81,'NAUGHTY ANGLE' 'Gorgeous' Emma Louise Jones enjoys Leeds win at Foxes in low-cut jumpsuit,'Gorgeous' Emma Louise Jones enjoys Leeds win at Foxes in low-cut jumpsuit,https://www.thesun.co.uk/sport/24627934/emma-louise-jones-leicester-0-1-leeds-jumpsuit/
